code;description;price;image;puntuation;altImage;fechaB01N3YD5XR;Nikon D5600 - Cámara réflex DE 24.2 MP sin objectivo (Pantalla táctil de 3", Full HD) Negro, versión Europea;EUR 651,95;https://images-eu.ssl-images-amazon.com/images/I/51uQ3XEqzhL._AC_US218_.jpg;3,9 de un máximo de 5 estrellas;Nikon D5600 - Cámara réflex DE 24.2 MP sin objectivo (Pantalla táctil de 3", Full HD) Negro, versión Europea;2018-10-25 19:33:38.965293B072639587;Nikon AF-P DX NIKKOR 10-20mm f/4.5-5.6G VR - Objetivo para cámara, color negro;EUR 318,95;https://images-eu.ssl-images-amazon.com/images/I/41vguPg3e1L._AC_US218_.jpg;3,8 de un máximo de 5 estrellas;Nikon AF-P DX NIKKOR 10-20mm f/4.5-5.6G VR - Objetivo para cámara, color negro;2018-10-25 19:33:38.968296B00HQCW7SS;Nikon D3300 - Cámara réflex digital de 24.2 Mp (pantalla LCD de 3", grabación de vídeo Full HD), color negro [Versión EU];EUR 399,00;https://images-eu.ssl-images-amazon.com/images/I/51xbVEruw+L._AC_US218_.jpg;4,4 de un máximo de 5 estrellas;Nikon D3300 - Cámara réflex digital de 24.2 Mp (pantalla LCD de 3", grabación de vídeo Full HD), color negro [Versión EU];2018-10-25 19:33:38.970295B007VGGIB6;Nikon WU-1A WLAN Adapter - Adaptador de red USB (WLAN 802.11b Port, WLAN 802.11g Port), Negro;EUR 59,00;https://images-eu.ssl-images-amazon.com/images/I/51wcDW7jkwL._AC_US218_.jpg;4,1 de un máximo de 5 estrellas;Nikon WU-1A WLAN Adapter - Adaptador de red USB (WLAN 802.11b Port, WLAN 802.11g Port), Negro;2018-10-25 19:33:38.973279B01G2WQJ54;Yongnuo YN 50MM F1.8 Lente Objetivo (Apertura F/1.8) para Nikon DSLR Cámara Fotografía, Enfoque Automático de Gran Apertura + WINGONEER difusión;EUR 79,99;https://images-eu.ssl-images-amazon.com/images/I/51Me7mWc2UL._AC_US218_.jpg;3,9 de un máximo de 5 estrellas;Yongnuo YN 50MM F1.8 Lente Objetivo (Apertura F/1.8) para Nikon DSLR Cámara Fotografía, Enfoque Automático de Gran Apertura + WINGONEER difusión;2018-10-25 19:33:38.976286B01C672QQ0;Nikon COOLPIX B700 20.3MP 1/2.3" CMOS 5184 x 3888Pixeles - Cámara Digital (Auto, Batería, Cámara Puente, TTL, 1/2.3", 4,3-258 mm);EUR 459,00;https://images-eu.ssl-images-amazon.com/images/I/51gYVi9XqDL._AC_US218_.jpg;3,8 de un máximo de 5 estrellas;Nikon COOLPIX B700 20.3MP 1/2.3" CMOS 5184 x 3888Pixeles - Cámara Digital (Auto, Batería, Cámara Puente, TTL, 1/2.3", 4,3-258 mm);2018-10-25 19:33:38.978286B00GE4MNQA;Neewer 750II TTL, Flash Speedlite con pantalla LCD para Nikon;EUR 58,99;https://images-eu.ssl-images-amazon.com/images/I/41vzbQSZ93L._AC_US218_.jpg;4,2 de un máximo de 5 estrellas;Neewer 750II TTL, Flash Speedlite con pantalla LCD para Nikon;2018-10-25 19:33:38.980284B071P55939;Powerextra Batería Nikon EN-EL14 para Nikon D3100, D3200, D3300, D5100, D5200, D5300, D5500, DF, Coolpix P7000, P7100, P7700, P7800 EN EL14a DSLR Cámara;EUR 19,99;https://images-eu.ssl-images-amazon.com/images/I/41B+ACUH8DL._AC_US218_.jpg;4,7 de un máximo de 5 estrellas;Powerextra Batería Nikon EN-EL14 para Nikon D3100, D3200, D3300, D5100, D5200, D5300, D5500, DF, Coolpix P7000, P7100, P7700, P7800 EN EL14a DSLR Cámara;2018-10-25 19:33:38.982284B01G1RMSZA;Godox X1T-N Primera TTL 2.4G Transmisor Inalámbrico Disparador de Flash para la Nikon D610 D800E D800 D700 D300s D300 D600 D5300 D5200 D3100 D7100 D90 D4s D3 Serie de DSLR Cámaras (X1T-N);EUR 44,00;https://images-eu.ssl-images-amazon.com/images/I/51mMvIs4D4L._AC_US218_.jpg;4,6 de un máximo de 5 estrellas;Godox X1T-N Primera TTL 2.4G Transmisor Inalámbrico Disparador de Flash para la Nikon D610 D800E D800 D700 D300s D300 D600 D5300 D5200 D3100 D7100 D90 D4s D3 Serie de DSLR Cámaras (X1T-N);2018-10-25 19:33:38.985282B01G1QU236;Godox X1N Primera TTL 2.4 G Transmisor Inalámbrico + Receptor Equipo Para la Nikon D610 D800E D800 D700 D300s D300 D600 D5300 D5200 D3100 D7100 D90 D4s D3 Serie de Cámaras (X1T-N+X1R-N);EUR 81,00;https://images-eu.ssl-images-amazon.com/images/I/51zvgfyO3hL._AC_US218_.jpg;4 de un máximo de 5 estrellas;Godox X1N Primera TTL 2.4 G Transmisor Inalámbrico + Receptor Equipo Para la Nikon D610 D800E D800 D700 D300s D300 D600 D5300 D5200 D3100 D7100 D90 D4s D3 Serie de Cámaras (X1T-N+X1R-N);2018-10-25 19:33:38.988285B007ORX8ME;Tokina AT-X 116 PRO DXII - Objetivo para Nikon APS-C (distancia focal 11-16mm, apertura f:2.8-22, diámetro: 77mm), negro;EUR 454,95;https://images-eu.ssl-images-amazon.com/images/I/51P1m5Q7zcL._AC_US218_.jpg;4,6 de un máximo de 5 estrellas;Tokina AT-X 116 PRO DXII - Objetivo para Nikon APS-C (distancia focal 11-16mm, apertura f:2.8-22, diámetro: 77mm), negro;2018-10-25 19:33:38.990284B00CGY6QKG;Nikon Monarch 5 - Prismático (10x42) negro;EUR 350,00;https://images-eu.ssl-images-amazon.com/images/I/41Ww35jkbAL._AC_US218_.jpg;4,4 de un máximo de 5 estrellas;Nikon Monarch 5 - Prismático (10x42) negro;2018-10-25 19:33:38.993282B004SH6OSI;Samyang F1110603101 AE - Objectivo para Nikon (14 mm IF ED UMC, sensor APS-C y Full-Frame), Negro;EUR 370,95;https://images-eu.ssl-images-amazon.com/images/I/41zWshRRGLL._AC_US218_.jpg;4,1 de un máximo de 5 estrellas;Samyang F1110603101 AE - Objectivo para Nikon (14 mm IF ED UMC, sensor APS-C y Full-Frame), Negro;2018-10-25 19:33:38.995281B01AUBSY38;Nikon D500 - Cámara digital (20.9 MP, montura F, 10 fps, 4K), color negro;EUR 1.757,10;https://images-eu.ssl-images-amazon.com/images/I/51wrpNwdAxL._AC_US218_.jpg;4,2 de un máximo de 5 estrellas;Nikon D500 - Cámara digital (20.9 MP, montura F, 10 fps, 4K), color negro;2018-10-25 19:33:38.997279844154042X;Nikon D7500 (Photoclub);EUR 33,20;https://images-eu.ssl-images-amazon.com/images/I/417YE+zD4vL._AC_US218_.jpg;3,5 de un máximo de 5 estrellas;Nikon D7500 (Photoclub);2018-10-25 19:33:38.999279B007WXPXO6;Nikon AF-S DX 35mm 1.8 G -  [Versión Nikonistas con garantía 5 años y cobertura de robo un año con el acceso a Nikonistas] Objetivo para Montura (distancia focal fija 52.5mm, apertura f/1.8) negro;EUR 194,90;https://images-eu.ssl-images-amazon.com/images/I/41FtgQymFDL._AC_US218_.jpg;4,6 de un máximo de 5 estrellas;Nikon AF-S DX 35mm 1.8 G -  [Versión Nikonistas con garantía 5 años y cobertura de robo un año con el acceso a Nikonistas] Objetivo para Montura (distancia focal fija 52.5mm, apertura f/1.8) negro;2018-10-25 19:33:39.001277B004U4UHTQ;Nikon D5100 - Cámara réflex digital de 16.2 Mp (pantalla articulada 3", estabilizador óptico, vídeo Full HD), color negro - kit con objetivo AF-S DX 18-55mm VR f/3.5 [importado];EUR 329,99;https://images-eu.ssl-images-amazon.com/images/I/41AP1FRW4YL._AC_US218_.jpg;4,3 de un máximo de 5 estrellas;Nikon D5100 - Cámara réflex digital de 16.2 Mp (pantalla articulada 3", estabilizador óptico, vídeo Full HD), color negro - kit con objetivo AF-S DX 18-55mm VR f/3.5 [importado];2018-10-25 19:33:39.004277B00U5W8HFI;Nikon D7200 - Cámara Digital réflex de Objetivo único, Color Negro;EUR 1.063,55;https://images-eu.ssl-images-amazon.com/images/I/51ibJgh5oBL._AC_US218_.jpg;4,2 de un máximo de 5 estrellas;Nikon D7200 - Cámara Digital réflex de Objetivo único, Color Negro;2018-10-25 19:33:39.007276B013UBXVI8;Camkix Lentes y juego de limpieza de pantalla – aerosol de limpieza, un paño de microfibra – Perfecto para limpiar la lente de su reflejo DSLR o camara GoPro - Tambien es ideal para su teléfono inteligente, tableta, portátil etc. (2 Botellas);EUR 7,49;https://images-eu.ssl-images-amazon.com/images/I/51DzpNvn0VL._AC_US218_.jpg;4,2 de un máximo de 5 estrellas;Camkix Lentes y juego de limpieza de pantalla – aerosol de limpieza, un paño de microfibra – Perfecto para limpiar la lente de su reflejo DSLR o camara GoPro - Tambien es ideal para su teléfono inteligente, tableta, portátil etc. (2 Botellas);2018-10-25 19:33:39.010267B00CHHJQ0O;CamKix Cleaning Kit - Pack de limpieza de equipos fotográficos (Canon, Nikon, Pentax, Sony) sin fluido de limpieza;EUR 8,99;https://images-eu.ssl-images-amazon.com/images/I/51WgWAs6+IL._AC_US218_.jpg;3,9 de un máximo de 5 estrellas;CamKix Cleaning Kit - Pack de limpieza de equipos fotográficos (Canon, Nikon, Pentax, Sony) sin fluido de limpieza;2018-10-25 19:33:39.013267B07D4YCPQG;Nikon D3400 + SDXC de 32 GB + Funda AmazonBasics -  [Versión española con acceso a Nikonistas y 6 cursos gratis] Kit de cámara réflex digital de 24.2 MP con objetivo estabilizado 18-55 AFP DX VR (LCD 3”, con Snapbridge, vídeo Full HD), color negro;EUR 467,78;https://images-eu.ssl-images-amazon.com/images/I/51PYutd+SQL._AC_US218_.jpg;4,3 de un máximo de 5 estrellas;Nikon D3400 + SDXC de 32 GB + Funda AmazonBasics -  [Versión española con acceso a Nikonistas y 6 cursos gratis] Kit de cámara réflex digital de 24.2 MP con objetivo estabilizado 18-55 AFP DX VR (LCD 3”, con Snapbridge, vídeo Full HD), color negro;2018-10-25 19:33:49.035690B078HTWK8P;Pixel MB-D18 Empuñadura Grip de Batería Agarre para Nikon D850 Cuerpo de la Cámara Compatible con Baterías De EN-EL15a EN-EL15 (reemplazo para Nikon MB-D18);EUR 102,00;https://images-eu.ssl-images-amazon.com/images/I/51uD8DGMqyL._AC_US218_.jpg;3,7 de un máximo de 5 estrellas;Pixel MB-D18 Empuñadura Grip de Batería Agarre para Nikon D850 Cuerpo de la Cámara Compatible con Baterías De EN-EL15a EN-EL15 (reemplazo para Nikon MB-D18);2018-10-25 19:33:49.038688B000CMNL52;Tokina 100 mm f/2.8 ATX M PRO D Macro Autofocus - Objetivo para Nikon (distancia focal fija 100mm, apertura f/2.8-32, diámetro: 55mm) color negro;EUR 341,95;https://images-eu.ssl-images-amazon.com/images/I/51Yo0TqYyrL._AC_US218_.jpg;4,7 de un máximo de 5 estrellas;Tokina 100 mm f/2.8 ATX M PRO D Macro Autofocus - Objetivo para Nikon (distancia focal fija 100mm, apertura f/2.8-32, diámetro: 55mm) color negro;2018-10-25 19:33:49.041686B01LXOTX7H;Yongnuo YN35mm F2N Objetivo focal fijo de 35 mm enfoque AF / MF con visi¨®n gran angular para c¨¢mara Nikon + TARION bolsa;EUR 100,99;https://images-eu.ssl-images-amazon.com/images/I/51bVbTlaSVL._AC_US218_.jpg;4,1 de un máximo de 5 estrellas;Yongnuo YN35mm F2N Objetivo focal fijo de 35 mm enfoque AF / MF con visi¨®n gran angular para c¨¢mara Nikon + TARION bolsa;2018-10-25 19:33:49.043695B01C672L2O;Nikon Coolpix A900 - Cámara compacta de 20.3" (WiFi, Bluetooth, 4K UHD, CMOS, Nikkor, modo PSAM, zoom 35x, reducción de la vibración, AF, TFT LCD inclinable) plata;EUR 346,53;https://images-eu.ssl-images-amazon.com/images/I/51GxteocrXL._AC_US218_.jpg;3,8 de un máximo de 5 estrellas;Nikon Coolpix A900 - Cámara compacta de 20.3" (WiFi, Bluetooth, 4K UHD, CMOS, Nikkor, modo PSAM, zoom 35x, reducción de la vibración, AF, TFT LCD inclinable) plata;2018-10-25 19:33:49.045696B01B5UZ4TA;Nikon D3300 + 18-55 AFP DX VR - Cámara réflex digital de 24,2 Mp (pantalla LCD 3", estabilizador, vídeo Full HD), color negro - kit con objetivo 18-55MM AFP DX VR;EUR 1.000,00;https://images-eu.ssl-images-amazon.com/images/I/41tq4QmmUCL._AC_US218_.jpg;4,4 de un máximo de 5 estrellas;Nikon D3300 + 18-55 AFP DX VR - Cámara réflex digital de 24,2 Mp (pantalla LCD 3", estabilizador, vídeo Full HD), color negro - kit con objetivo 18-55MM AFP DX VR;2018-10-25 19:33:49.047694B00U8KSI0Q;Nikon D7200 - Cámara réflex Digital de 24.2 MP (Pantalla de 3.2", FHD, WiFi), Color Negro - Kit con Objetivo AF-S Nikkor 18-140 mm, f/3.5-5.6 ED VR;EUR 1.161,95;https://images-eu.ssl-images-amazon.com/images/I/51B3ZLdy48L._AC_US218_.jpg;3,9 de un máximo de 5 estrellas;Nikon D7200 - Cámara réflex Digital de 24.2 MP (Pantalla de 3.2", FHD, WiFi), Color Negro - Kit con Objetivo AF-S Nikkor 18-140 mm, f/3.5-5.6 ED VR;2018-10-25 19:33:49.049686B075RZYR2J;Ourlife Niños Cámaras Deportivas, Cámara de Acción para Niños con Tarjeta de Memoria 8GB (Azul);EUR 42,99;https://images-eu.ssl-images-amazon.com/images/I/51toJl6vEKL._AC_US218_.jpg;3,5 de un máximo de 5 estrellas;Ourlife Niños Cámaras Deportivas, Cámara de Acción para Niños con Tarjeta de Memoria 8GB (Azul);2018-10-25 19:33:49.051691B01G1RMSZA;Godox X1T-N Primera TTL 2.4G Transmisor Inalámbrico Disparador de Flash para la Nikon D610 D800E D800 D700 D300s D300 D600 D5300 D5200 D3100 D7100 D90 D4s D3 Serie de DSLR Cámaras (X1T-N);EUR 44,00;https://images-eu.ssl-images-amazon.com/images/I/51mMvIs4D4L._AC_US218_.jpg;4,6 de un máximo de 5 estrellas;Godox X1T-N Primera TTL 2.4G Transmisor Inalámbrico Disparador de Flash para la Nikon D610 D800E D800 D700 D300s D300 D600 D5300 D5200 D3100 D7100 D90 D4s D3 Serie de DSLR Cámaras (X1T-N);2018-10-25 19:33:49.054700B00CHHJQ0O;CamKix Cleaning Kit - Pack de limpieza de equipos fotográficos (Canon, Nikon, Pentax, Sony) sin fluido de limpieza;EUR 8,99;https://images-eu.ssl-images-amazon.com/images/I/51WgWAs6+IL._AC_US218_.jpg;3,9 de un máximo de 5 estrellas;CamKix Cleaning Kit - Pack de limpieza de equipos fotográficos (Canon, Nikon, Pentax, Sony) sin fluido de limpieza;2018-10-25 19:33:49.057688B06ZZ6FG37;Nikon ENEL15a Ión de Litio batería Recargable - Batería/Pila Recargable (Ión de Litio, Negro);EUR 58,00;https://images-eu.ssl-images-amazon.com/images/I/41pwiqFsRpL._AC_US218_.jpg;4,6 de un máximo de 5 estrellas;Nikon ENEL15a Ión de Litio batería Recargable - Batería/Pila Recargable (Ión de Litio, Negro);2018-10-25 19:33:49.059693B00V5ORSYQ;Newmowa EN-EL14 EN-EL14a Batería de repuesto (2-Pack) y Kit de Cargador Doble para Micro USB portátil para Nikon EN-EL14, EN-EL14a y Nikon P7000, P7100, P7700, P7800, D3100, D3200, D3300, D3500, D5100, D5200, D5300,D5500;EUR 27,99;https://images-eu.ssl-images-amazon.com/images/I/51f7J8Pp3bL._AC_US218_.jpg;4,4 de un máximo de 5 estrellas;Newmowa EN-EL14 EN-EL14a Batería de repuesto (2-Pack) y Kit de Cargador Doble para Micro USB portátil para Nikon EN-EL14, EN-EL14a y Nikon P7000, P7100, P7700, P7800, D3100, D3200, D3300, D3500, D5100, D5200, D5300,D5500;2018-10-25 19:33:49.061690B01LZURSX9;Nikon Coolpix W100 - Cámara digital compacta de 13.2 MP con mochila (pantalla LCD de 2.7", CMOS, Snapbridge, VR, objetivo Nikkor, USB, vídeo Full HD, WiFi) Azul;EUR 148,99;https://images-eu.ssl-images-amazon.com/images/I/41p5kZF+1gL._AC_US218_.jpg;3,7 de un máximo de 5 estrellas;Nikon Coolpix W100 - Cámara digital compacta de 13.2 MP con mochila (pantalla LCD de 2.7", CMOS, Snapbridge, VR, objetivo Nikkor, USB, vídeo Full HD, WiFi) Azul;2018-10-25 19:33:49.063689B00ICJWP6S;Sigma 50 mm f/1.4 - Objetivo para Nikon (50mm, f/1.4, zoom óptico 1x, 77 mm), color negro;EUR 740,00;https://images-eu.ssl-images-amazon.com/images/I/41ELe9kPlTL._AC_US218_.jpg;4,4 de un máximo de 5 estrellas;Sigma 50 mm f/1.4 - Objetivo para Nikon (50mm, f/1.4, zoom óptico 1x, 77 mm), color negro;2018-10-25 19:33:49.066686;MYAMIA Recambio Goma Agarre Trasero Cubierta Posterior Y La Cinta Adhesiva del Pulgar para Nikon D90;EUR 4,16;https://images-eu.ssl-images-amazon.com/images/I/41mS+ZHuC0L._AC_US218_.jpg;;MYAMIA Recambio Goma Agarre Trasero Cubierta Posterior Y La Cinta Adhesiva del Pulgar para Nikon D90;2018-10-25 19:33:49.068680B01HEX3AZ2;YONGNUO YN50mm F1.8 Abertura Grande AF Enfoque Automático FX DX Lente Full Frame para Nikon + Andoer Paño de Limpieza;EUR 76,99;https://images-eu.ssl-images-amazon.com/images/I/51MO07YtK5L._AC_US218_.jpg;3,9 de un máximo de 5 estrellas;YONGNUO YN50mm F1.8 Abertura Grande AF Enfoque Automático FX DX Lente Full Frame para Nikon + Andoer Paño de Limpieza;2018-10-25 19:33:49.073668;hakutatz 48 Macro LED Ring Flash Lámpara Set para Canon/Nikon/Panasonic/Olympus/Pentax SLR Cámara (Macro anillo cabeza de control, con pantalla LCD, 4 x – Difusor de flash, 8 x Adapter Ring);EUR 28,99;https://images-eu.ssl-images-amazon.com/images/I/51PmhcC5hkL._AC_US218_.jpg;;hakutatz 48 Macro LED Ring Flash Lámpara Set para Canon/Nikon/Panasonic/Olympus/Pentax SLR Cámara (Macro anillo cabeza de control, con pantalla LCD, 4 x – Difusor de flash, 8 x Adapter Ring);2018-10-25 19:33:49.076676B01FTH2TN4;Godox V860II-N Flash Speedlite con Incorporado 2.4G con i-TTL Flash Automático + Li-on Batería + Flash Difusor Softbox para Nikon D800 D700 D7100 D7000 D5200 D5100 D5000 D300 D300S D3200 D3100 D3000 D200 D70S D810 D610 D90 D750;EUR 189,00;https://images-eu.ssl-images-amazon.com/images/I/511I1uPT-4L._AC_US218_.jpg;3,7 de un máximo de 5 estrellas;Godox V860II-N Flash Speedlite con Incorporado 2.4G con i-TTL Flash Automático + Li-on Batería + Flash Difusor Softbox para Nikon D800 D700 D7100 D7000 D5200 D5100 D5000 D300 D300S D3200 D3100 D3000 D200 D70S D810 D610 D90 D750;2018-10-25 19:33:49.078674B013UBXVI8;Camkix Lentes y juego de limpieza de pantalla – aerosol de limpieza, un paño de microfibra – Perfecto para limpiar la lente de su reflejo DSLR o camara GoPro - Tambien es ideal para su teléfono inteligente, tableta, portátil etc. (2 Botellas);EUR 7,49;https://images-eu.ssl-images-amazon.com/images/I/51DzpNvn0VL._AC_US218_.jpg;4,2 de un máximo de 5 estrellas;Camkix Lentes y juego de limpieza de pantalla – aerosol de limpieza, un paño de microfibra – Perfecto para limpiar la lente de su reflejo DSLR o camara GoPro - Tambien es ideal para su teléfono inteligente, tableta, portátil etc. (2 Botellas);2018-10-25 19:33:49.081674B01G1QU236;Godox X1N Primera TTL 2.4 G Transmisor Inalámbrico + Receptor Equipo Para la Nikon D610 D800E D800 D700 D300s D300 D600 D5300 D5200 D3100 D7100 D90 D4s D3 Serie de Cámaras (X1T-N+X1R-N);EUR 81,00;https://images-eu.ssl-images-amazon.com/images/I/51zvgfyO3hL._AC_US218_.jpg;4 de un máximo de 5 estrellas;Godox X1N Primera TTL 2.4 G Transmisor Inalámbrico + Receptor Equipo Para la Nikon D610 D800E D800 D700 D300s D300 D600 D5300 D5200 D3100 D7100 D90 D4s D3 Serie de Cámaras (X1T-N+X1R-N);2018-10-25 19:33:49.084663B01FTH2TN4;Godox V860II-N Flash Speedlite con Incorporado 2.4G con i-TTL Flash Automático + Li-on Batería + Flash Difusor Softbox para Nikon D800 D700 D7100 D7000 D5200 D5100 D5000 D300 D300S D3200 D3100 D3000 D200 D70S D810 D610 D90 D750;EUR 189,00;https://images-eu.ssl-images-amazon.com/images/I/511I1uPT-4L._AC_US218_.jpg;3,7 de un máximo de 5 estrellas;Godox V860II-N Flash Speedlite con Incorporado 2.4G con i-TTL Flash Automático + Li-on Batería + Flash Difusor Softbox para Nikon D800 D700 D7100 D7000 D5200 D5100 D5000 D300 D300S D3200 D3100 D3000 D200 D70S D810 D610 D90 D750;2018-10-25 19:33:51.306642B072BG886W;The Nikon Autofocus System: Mastering Focus for Sharp Images Every Time (English Edition);EUR 6,86;https://images-eu.ssl-images-amazon.com/images/I/61jVi-yhxfL._AC_US218_.jpg;5 de un máximo de 5 estrellas;The Nikon Autofocus System: Mastering Focus for Sharp Images Every Time (English Edition);2018-10-25 19:33:51.309640B0042X9L6A;Nikon SB-700 - Flash de zapata para cámaras réflex Nikon;EUR 273,95;https://images-eu.ssl-images-amazon.com/images/I/41ovwMx+y4L._AC_US218_.jpg;4,3 de un máximo de 5 estrellas;Nikon SB-700 - Flash de zapata para cámaras réflex Nikon;2018-10-25 19:33:51.311640B019XRLZWW;SHOOT MC-DC2 Temporizador Cable del Disparador Remoto del de Pantalla LCD para Nikon D90 D600 D610 D3100 D3200 D3300 D5000 D5100 D5200 D5300 D7000 Cámara Digital SLR;EUR 15,69;https://images-eu.ssl-images-amazon.com/images/I/41SbhzkCD8L._AC_US218_.jpg;4,1 de un máximo de 5 estrellas;SHOOT MC-DC2 Temporizador Cable del Disparador Remoto del de Pantalla LCD para Nikon D90 D600 D610 D3100 D3200 D3300 D5000 D5100 D5200 D5300 D7000 Cámara Digital SLR;2018-10-25 19:33:51.313639B076HLRB6L;Pixel Pro 2.4GHz Inalámbrico Disparador a Distancia con Temporizador TW283-DC2 Timer Disparador Remoto para Nikon DF D5600 D3100 D3200 D3300 D5000 D5100 D5200 D5300 D5500 D7000 D7100 D7200 D610 D750;EUR 32,00;https://images-eu.ssl-images-amazon.com/images/I/51QfszRnNXL._AC_US218_.jpg;4,1 de un máximo de 5 estrellas;Pixel Pro 2.4GHz Inalámbrico Disparador a Distancia con Temporizador TW283-DC2 Timer Disparador Remoto para Nikon DF D5600 D3100 D3200 D3300 D5000 D5100 D5200 D5300 D5500 D7000 D7100 D7200 D610 D750;2018-10-25 19:33:51.315647B000FFP15E;Nikon Travelite EX CF - Prismático, negro;EUR 134,98;https://images-eu.ssl-images-amazon.com/images/I/41cBc1yQ1TL._AC_US218_.jpg;4,5 de un máximo de 5 estrellas;Nikon Travelite EX CF - Prismático, negro;2018-10-25 19:33:51.317646B06ZYCS62R;Nikkon D7500 - Cámara réflex Digital DE 20.9 MP (Pantalla LCD 3.2", 4K/UHD, SnapBridge, Bluetooth, WiFi) Color Negro - Kit con Objetivo AF-S DX 18-140 mm f/3.5-5.6G ED VR;EUR 1.502,95;https://images-eu.ssl-images-amazon.com/images/I/51aCol7rxQL._AC_US218_.jpg;4,6 de un máximo de 5 estrellas;Nikkon D7500 - Cámara réflex Digital DE 20.9 MP (Pantalla LCD 3.2", 4K/UHD, SnapBridge, Bluetooth, WiFi) Color Negro - Kit con Objetivo AF-S DX 18-140 mm f/3.5-5.6G ED VR;2018-10-25 19:33:51.3206358441537399;Nikon D750 (Photoclub);EUR 28,45;https://images-eu.ssl-images-amazon.com/images/I/41TOn9zRs9L._AC_US218_.jpg;3,8 de un máximo de 5 estrellas;Nikon D750 (Photoclub);2018-10-25 19:33:51.323644B01G1RMSZA;Godox X1T-N Primera TTL 2.4G Transmisor Inalámbrico Disparador de Flash para la Nikon D610 D800E D800 D700 D300s D300 D600 D5300 D5200 D3100 D7100 D90 D4s D3 Serie de DSLR Cámaras (X1T-N);EUR 44,00;https://images-eu.ssl-images-amazon.com/images/I/51mMvIs4D4L._AC_US218_.jpg;4,6 de un máximo de 5 estrellas;Godox X1T-N Primera TTL 2.4G Transmisor Inalámbrico Disparador de Flash para la Nikon D610 D800E D800 D700 D300s D300 D600 D5300 D5200 D3100 D7100 D90 D4s D3 Serie de DSLR Cámaras (X1T-N);2018-10-25 19:33:51.326642B01G1QU236;Godox X1N Primera TTL 2.4 G Transmisor Inalámbrico + Receptor Equipo Para la Nikon D610 D800E D800 D700 D300s D300 D600 D5300 D5200 D3100 D7100 D90 D4s D3 Serie de Cámaras (X1T-N+X1R-N);EUR 81,00;https://images-eu.ssl-images-amazon.com/images/I/51zvgfyO3hL._AC_US218_.jpg;4 de un máximo de 5 estrellas;Godox X1N Primera TTL 2.4 G Transmisor Inalámbrico + Receptor Equipo Para la Nikon D610 D800E D800 D700 D300s D300 D600 D5300 D5200 D3100 D7100 D90 D4s D3 Serie de Cámaras (X1T-N+X1R-N);2018-10-25 19:33:51.329640B01C672RX2;Nikon COOLPIX B700 - Cámara Digital Auto, Negro y borgoña;EUR 420,64;https://images-eu.ssl-images-amazon.com/images/I/518p9BTaFQL._AC_US218_.jpg;3,8 de un máximo de 5 estrellas;Nikon COOLPIX B700 - Cámara Digital Auto, Negro y borgoña;2018-10-25 19:33:51.331639;Mastering the Nikon D7500;EUR 35,47;https://images-eu.ssl-images-amazon.com/images/I/411qe7ecfNL._AC_US218_.jpg;;Mastering the Nikon D7500;2018-10-25 19:33:51.333638B00UN04Q1G;Neewer pantalla LCD temporizador y mando a distancia de disparo del obturador yp-880/DC2 para Nikon D7100 D7000 D5300 D5100 D5000 D3300 D3200 D3100 D610 D600 D90 DF cámaras réflex digitales;EUR 12,15;https://images-eu.ssl-images-amazon.com/images/I/41AnTgOUMEL._AC_US218_.jpg;3,7 de un máximo de 5 estrellas;Neewer pantalla LCD temporizador y mando a distancia de disparo del obturador yp-880/DC2 para Nikon D7100 D7000 D5300 D5100 D5000 D3300 D3200 D3100 D610 D600 D90 DF cámaras réflex digitales;2018-10-25 19:33:51.336640B00JO64MY6;Neewer RF550D, 48 Macro LED Anillo Flash Bundle con Pantalla LCD,Control de Potencia,Anillos Adaptadores y Difusores Flash;EUR 24,99;https://images-eu.ssl-images-amazon.com/images/I/51oMaVDrSjL._AC_US218_.jpg;3,8 de un máximo de 5 estrellas;Neewer RF550D, 48 Macro LED Anillo Flash Bundle con Pantalla LCD,Control de Potencia,Anillos Adaptadores y Difusores Flash;2018-10-25 19:33:51.338640B019OZPEKW;Troy EH5 de ep5 a adaptador de red para Nikon D3100, D3200, D3300, D5100, D5200, D5500 COOLPIX P7000 P7100, P7700, P7800 como repuesto EH de 5 EP-5 A ep5 a Negro;EUR 39,90;https://images-eu.ssl-images-amazon.com/images/I/51Jwobci+ML._AC_US218_.jpg;3,5 de un máximo de 5 estrellas;Troy EH5 de ep5 a adaptador de red para Nikon D3100, D3200, D3300, D5100, D5200, D5500 COOLPIX P7000 P7100, P7700, P7800 como repuesto EH de 5 EP-5 A ep5 a Negro;2018-10-25 19:33:51.340638B01MDOWPG7;YONGNUO YN35 35mm F2.0 gran angular Primer de lentes grandes abertura Manual de enfoque automático AF MF para Nikon Cámaras DSLR + WINGONEER difusor de flash;EUR 94,99;https://images-eu.ssl-images-amazon.com/images/I/51+Ji2kbLSL._AC_US218_.jpg;3,9 de un máximo de 5 estrellas;YONGNUO YN35 35mm F2.0 gran angular Primer de lentes grandes abertura Manual de enfoque automático AF MF para Nikon Cámaras DSLR + WINGONEER difusor de flash;2018-10-25 19:33:51.343622;Nick Nikon (feat. Key);;https://images-eu.ssl-images-amazon.com/images/G/30/x-site/icons/no-img-sm._CB1303168197_AC_US218_.gif;;Nick Nikon (feat. Key);2018-10-25 19:33:51.344621B009A98OL4;Maxsimafoto - ENEL15, EN-EL15 batería de 1900mAh totalmente compatible para NIKON D600, D610, D800, D810, D7000, D7100, D7200 Nikon 1 V1, decodificado.;EUR 24,99;https://images-eu.ssl-images-amazon.com/images/I/41WkfGny1TL._AC_US218_.jpg;2,4 de un máximo de 5 estrellas;Maxsimafoto - ENEL15, EN-EL15 batería de 1900mAh totalmente compatible para NIKON D600, D610, D800, D810, D7000, D7100, D7200 Nikon 1 V1, decodificado.;2018-10-25 19:33:51.346620B013UBXVI8;Camkix Lentes y juego de limpieza de pantalla – aerosol de limpieza, un paño de microfibra – Perfecto para limpiar la lente de su reflejo DSLR o camara GoPro - Tambien es ideal para su teléfono inteligente, tableta, portátil etc. (2 Botellas);EUR 7,49;https://images-eu.ssl-images-amazon.com/images/I/51DzpNvn0VL._AC_US218_.jpg;4,2 de un máximo de 5 estrellas;Camkix Lentes y juego de limpieza de pantalla – aerosol de limpieza, un paño de microfibra – Perfecto para limpiar la lente de su reflejo DSLR o camara GoPro - Tambien es ideal para su teléfono inteligente, tableta, portátil etc. (2 Botellas);2018-10-25 19:33:51.349618